{
  "schema_version": "1.0",
  "task_key": "F04",
  "tested_commit": "a9aa1f1ef2b532a4c2a9f1c6e4ddc9861feac18b",
  "environment": "synthetic fixture only",
  "evidence_level": "SANDBOX_QUALIFIED",
  "cases": [
    {
      "id": "synthetic-contract",
      "status": "PASS",
      "reason": "Illustrative fixture; not a real qualification receipt"
    },
    {
      "id": "live-provider",
      "status": "NOT_RUN",
      "reason": "No provider access authorized"
    }
  ],
  "independent_executor": "synthetic-verifier",
  "artifact_hashes": {
    "fixtures/example.json": "bbbbbbbbbbbbbbbbbbbbbbbbbbbbbbbbbbbbbbbbbbbbbbbbbbbbbbbbbbbbbbbb"
  },
  "limitations": [
    "Synthetic specimen; no independent acceptance or production authority"
  ],
  "producer_ref": "synthetic-producer",
  "recorded_at": "2026-10-25T12:00:00Z",
  "production_authorization_ref": null
}
